,type,title,description,viewCount,lengthText,badges,country,date
0,video,Animation • 2014,"The first-ever full-length theatrical LEGO movie follows Emmet an ordinary, rules-following, perfectly average LEGO minifigure who is mistakenly identified as the most extraordinary person...",,1:40:32,"['Free with ads', 'PG']",CA,2024-10-14
1,video,7 Days Exploring An Underground City,"This salt mine is the coolest underground city I’ve ever seen
Get Zaxbys MrBeast Box while you still can - Chicken Fingerz™, cheddar bites, fries, double Texas toast, signature sauces,...",43299397,20:35,,CA,2024-10-14
2,video_listing,Trending,,,,,CA,2024-10-14
3,video,What If Goku Saved Gohan From The Androids? Dragon Ball Sparking Zero,"Dragon Ball Sparking Zero is amazing. Today I'm playing the levels you guys made for my #XLCustom themes and BRAH... These What If battles are insane

Dragon Ball Sparking Zero Playlist: https://ww...",177223,46:58,,CA,2024-10-14
4,video,Diddy's Life Inside NYC Hellhole Jail,"Sean Combs, aka P. Diddy aka Puff Daddy—or should we say, inmate 37452-054—is enduring a true nightmare at New York’s Metropolitan Detention Center in Brooklyn. This facility, often labeled...",792641,8:29,,CA,2024-10-14
5,video,USA vs Panama 2-0 - All Goals & Highlights - 2024 || new match,"#usa #panama #pulisic
#usa  #panama  #pulisic 
USA vs Panama 2-0 - All Goals & Highlights - 2024 || new match
USA vs Panama 
Panama vs USA 
USA vs Panama Highlights 
USA vs Panama Resumen ...",1450,9:41,,CA,2024-10-14
6,video,"I met the gangs of Port-au-Prince, capital of Haiti","N'oublie pas de t'abonner !

Foncez voir la vidéo coulisse de notre reportage avec Théotime Massard sur sa chaine !
https://youtu.be/TUJIipr2Cfw

Merci à Karim Daniel-Clesca qui a fait toutes...",503745,31:16,,CA,2024-10-14
7,video,Houston Texans vs. New England Patriots | 2024 Week 6 Game Highlights,"Watch live local and primetime games, NFL RedZone, and NFL Network on Plus.NFL.com

Check out our other channels:
NFL Mundo https://www.youtube.com/mundonfl
NFL Brasil https://www.youtube.com/c/NFL...",379620,12:48,,CA,2024-10-14
8,video,SpongeBob’s Most PAINFUL Moments 😣 | 60 Minute Compilation | @SpongeBobOfficial,"Get ready to wince, cringe, and maybe even laugh, because we’re diving into 60 minutes of the most painful moments in Bikini Bottom! 😣

#spongebob #spongebobsquarepants #nickelodeon 
...",268338,1:01:44,,CA,2024-10-14
9,video,Fat King & The Lying Jester | Ep 239 | Bad Friends,"Get Tickets to ""Scary Times USA"" live show at: https://www.moment.co/badfriends
Get MORE Bad Friends at our Patreon!! https://www.patreon.com/badfriends
Thank you to our Sponsors: Displate,...",864134,1:10:40,,CA,2024-10-14
10,video,"Musique Douce: Relaxante, Calme - Nature Relaxation","Musique douce et relaxante avec 4K vidéo de la forêt et  chute d'eau, musique calme et nature, relaxation.
Playlist Musique Relaxante: https://www.youtube.com/playlist?list=PLKxspWK8-EBAG02ZcuFVM...",86361185,2:04:50,,CA,2024-10-14
11,video,Rabbi Ryan Bauer - Yom Kippur Morning 2024 Sermon,,320,21:58,,CA,2024-10-14
12,video,Entitled Florida ‘Karen’ Demands Manager & Gets Arrested Instead | Instant Karma,"Discover June’s Journey for FREE! Tap here to download: https://woo.ga/fjljty0g Play on Android, iOS, and PC through Facebook Games.

OMG! Get your new Petty University VALID apparel here!...",153683,35:25,,CA,2024-10-14
13,video,A Side of Canada The Media Won't Show You!,"A Side of Canada The Media Won't Show You is a video of me exploring the unseen parts of Toronto, Canada. It's my first trip to this side of North America, and I show you what life is like...",316894,28:52,,CA,2024-10-14
14,video,"4 Days Hunting Ducks, Geese & Fishing Nome Alaska","We're flying North to Nome Alaska along the Bering Sea to hunt ducks, geese, swans, ptarmigan, fish for salmon and more. Its a four day adventure in one of my favorite parts of Alaska. 

Dredge...",3734241,41:30,,CA,2024-10-14
15,video,The Subway Surfers of New York,"Patreon Exclusive Clips: https://www.patreon.com/tommygmcgee
Big Dog Merch: https://tommygmcgee.com/

NLN Squad: 
Main Guy ""James"" : @c.mvrdaaa

Terrell: @terrellismail   
Wish him well on...",1050088,27:06,,CA,2024-10-14
16,video,"Rudder Failure at 35,000 Feet | Mayday Air Disaster","Northwest Flight 85 faces a catastrophic rudder failure at 35,000 feet. Watch as the crew battles a Boeing 747 emergency, fighting hydraulic issues to save 386 lives. A gripping tale of cockpit...",270610,45:01,,CA,2024-10-14
17,video,New Action Movie 2024  - Service Assassin -  Best Hollywood Action Movies Full HD English,New Action Movie 2024  - Service Assassin -  Best Hollywood Action Movies Full HD English,410255,1:42:14,,CA,2024-10-14
18,video,What Will Our World Look Like at 4 Degrees?,"Get the PBS App to watch Weathered: Earth’s Extremes for free!  https://to.pbs.org/PBSAppWeathered

If you're outside of the US and want to watch the show, you can check it out on PBS.org:...",458385,13:11,,CA,2024-10-14
19,video,Action & adventure • 2015,"Continuing the global exploits in the franchise built on speed, Vin Diesel leads the returning cast of ""Furious 7."" After defeating Owen Shaw and his crew, Dominic Toretto (Vin Diesel), Brian...",,2:17:21,"['Free with ads', 'PG-13']",CA,2024-10-14
20,video,Joe Rogan Experience #2211 - Michael Shellenberger,"Michael Shellenberger is an investigative journalist and founder of Public, a Substack publication, founder and president of Environmental Progress, a research organization that incubates ideas,...",940088,3:15:30,,CA,2024-10-14
21,video,Duke vs. Stanford Full Match Replay | 2024 ACC Women's Soccer,Duke vs. Stanford Full Match Replay | 2024 ACC Women's Soccer,386,1:41:09,,CA,2024-10-14
22,video,I Let Popular Food Companies Control My Diet For 7 Days,"Might be awhile before I check my DMs again.. 
Subscribe: https://www.youtube.com/c/ErikTheElectric?sub_confirmation=1 

Get Making Carbs Great Again Merch: https://eriktheelectric.shop/products/ma...",2029473,39:43,,CA,2024-10-14
